,questions,link_to_answer
1,Sunday megathread: What's everyone working on this week?,https://www.reddit.com/r/Python/comments/j0gs61/sunday_megathread_whats_everyone_working_on_this/
2,How do people usually avoid rolling their own auth system when making a Python web application/API?,https://www.reddit.com/r/Python/comments/j18wi3/how_do_people_usually_avoid_rolling_their_own/
3,"I made my first IoT thingy with Arduino, which I use to call my Google Cloud Function to process the data with Python",https://www.reddit.com/r/Python/comments/j16jtv/i_made_my_first_iot_thingy_with_arduino_which_i/
4,Python 3.5 has hit end-of-life. Here's what you can rely on in a Python 3.6+ world!,https://www.reddit.com/r/Python/comments/j1kt44/python_35_has_hit_endoflife_heres_what_you_can/
5,Why data quality is key to successful ML Ops,https://greatexpectations.io/blog/ml-ops-data-quality/
6,How to Make A Discord Bot in Python Part 1!,https://www.youtube.com/watch?v=g7q0A01OgAs
7,Why you should try VizTracer to understand your python program,https://www.reddit.com/r/Python/comments/j0dj8q/why_you_should_try_viztracer_to_understand_your/
8,How should I build a dynamic front end for a Flask backend?,https://www.reddit.com/r/Python/comments/j0o8by/how_should_i_build_a_dynamic_front_end_for_a/
9,"How wold you write a very simple script, without if, else and elif statements?",https://www.reddit.com/r/Python/comments/j0rfn9/how_wold_you_write_a_very_simple_script_without/
10,I hear people saying Python is slow compared to a lot of other programming languages. is this true? who programs in python for large applications where speed matters?,https://www.reddit.com/r/Python/comments/j0f1f1/i_hear_people_saying_python_is_slow_compared_to_a/
11,How I used Python to automatically create YouTube videos!,https://youtu.be/O7zjiCYJe3s
12,Python Cheatsheets I Created To Teach Myself How to Make a Stock Trading Bot,https://www.reddit.com/r/Python/comments/izsee0/python_cheatsheets_i_created_to_teach_myself_how/
13,"How is the market for Freelancer, Data Scientist?",https://www.reddit.com/r/Python/comments/izxz1g/how_is_the_market_for_freelancer_data_scientist/
14,How We Use Python's Fire &amp; Boto Modules to Manage 100+ Repos in Serverless Data Pipelines,https://medium.com/whispering-data/tackling-fragmentation-in-serverless-data-pipelines-b4027f506ee5
15,How to NEVER use lambdas - Python 3 edition,https://gist.github.com/MineRobber9000/19c331a9f5d8e994a4ed251f0ffa1e98
16,Why should docstrings go inside the function body as opposed to before the function header?,https://www.reddit.com/r/Python/comments/iyvcn2/why_should_docstrings_go_inside_the_function_body/
17,I made a rock paper scissors so what are your thoughts on the code and how can I improve,https://www.reddit.com/r/Python/comments/iz5v6w/i_made_a_rock_paper_scissors_so_what_are_your/
18,How to create minimal interline spacing between vertical lines?,https://www.reddit.com/r/Python/comments/iz3fqq/how_to_create_minimal_interline_spacing_between/
19,I had tried to visualise the sorting of a data structure for the programmers who are new in data structure,https://v.redd.it/4zow9alp1uo51
20,Should i try to learn how the libraries are made?,https://www.reddit.com/r/Python/comments/iyo4ij/should_i_try_to_learn_how_the_libraries_are_made/
21,How to use Earth Engine with pydeck for 3D terrain visualization,https://blog.gishub.org/earth-engine-tutorial-37-how-to-use-earth-engine-with-pydeck-for-3d-terrain-visualization
22,I learned python fundamentals and I am currently learning the OOP so my question is how to practice OOP and how to know it's enough tutorials and what to do after it should I watch some projects tutorial then start my own project because I dont want to get stuck in tutorials hell,https://www.reddit.com/r/Python/comments/iymyrd/i_learned_python_fundamentals_and_i_am_currently/
23,Why Python Is Used For Developing Automated Trading Strategy?,https://www.reddit.com/r/Python/comments/iyr00u/why_python_is_used_for_developing_automated/
24,u/Aaris_Kasi 's post on sorting visualizations had reminded me of a bubble sort visualization which I had wrote for the same reason as his. I don't have any images or videos but here's the code. Any criticism is appreciated! It uses Pygame!,https://www.reddit.com/r/Python/comments/iy91w2/uaaris_kasi_s_post_on_sorting_visualizations_had/
25,How to add Python Code to your Blog or webpage?,https://pysnakeblog.blogspot.com/2020/01/how-to-add-python-code-to-your-blog-or.html
26,How Uni Codes in Python are Processed,https://www.reddit.com/r/Python/comments/ixx2pf/how_uni_codes_in_python_are_processed/
27,Anyone have a **kwargs example that clearly showcases a benefit to using **kwargs over positional arguments or *args?,https://www.reddit.com/r/Python/comments/ixrqq8/anyone_have_a_kwargs_example_that_clearly/
28,Looking for people who would like to criticize my project,https://www.reddit.com/r/Python/comments/ixr5ck/looking_for_people_who_would_like_to_criticize_my/
29,How To Modify Python Exploits Like a Developer | Cyberseclabs Fuel Walkt...,https://www.reddit.com/r/Python/comments/ixj3pw/how_to_modify_python_exploits_like_a_developer/
30,Why does IDLE lag/stutter when dragging the window in Windows while it works fine on Linux?,https://www.reddit.com/r/Python/comments/ixsb0f/why_does_idle_lagstutter_when_dragging_the_window/
31,UPS-Display: a Python script to show on a e-Ink display stats about your UPS!,https://www.reddit.com/r/Python/comments/ixiglq/upsdisplay_a_python_script_to_show_on_a_eink/
32,Is PySpark what I'm looking for?,/r/apachespark/comments/ixom5y/is_spark_what_im_looking_for/
33,I made a Whatsapp message bomber/bot using python web scraping,https://www.reddit.com/r/Python/comments/ixj55o/i_made_a_whatsapp_message_bomberbot_using_python/
34,Just made a learning Python Diagram that I made my background to learn terms easier. Let me know what you think.,https://i.redd.it/wuvo5ea1hfo51.png
35,What boilerplate do you wish existed whenever you started new projects?,https://www.reddit.com/r/Python/comments/ixd250/what_boilerplate_do_you_wish_existed_whenever_you/
36,Can someone tell whats wrong with my python linter? Its in spanish but the general error messages are in english,https://i.redd.it/bom37aho7po51.jpg
37,Latest: A browser extension that finds code implementations for machine learning papers anywhere on the web!,/r/LatestInML/comments/ixepmg/latest_a_browser_extension_that_finds_code/
38,Why have I not been using f-strings...,https://www.reddit.com/r/Python/comments/iwdzzx/why_have_i_not_been_using_fstrings/
39,Why Python has won among dynamic languages,https://www.notonlycode.org/why-python-has-won/
40,What is the current development direction for Python?,https://www.reddit.com/r/Python/comments/ixbr1y/what_is_the_current_development_direction_for/
41,Plotting graphs using python and Matplotlib: How to Plot A SIMPLE LINE ...,https://www.youtube.com/watch?v=Zp5qV4Lmthw&amp;feature=share
42,Things you wish you had known when you first started learning programming,https://www.reddit.com/r/Python/comments/iwiiwz/things_you_wish_you_had_known_when_you_first/
43,Python behind the scenes #2: how the CPython compiler works,https://tenthousandmeters.com/blog/python-behind-the-scenes-2-how-the-cpython-compiler-works/
44,Nodejs vs Python – Which is the Best Option for your Web App Development?,https://tekkiwebsolutions.com/blog/nodejs-vs-python/
45,An interview about how the Newspaper library simplifies data extraction for journalistic web sites and integrating with natural language processing frameworks.,https://www.pythonpodcast.com/newspaper-data-extraction-episode-280/
46,Sunday megathread: What's everyone working on this week?,https://www.reddit.com/r/Python/comments/iw3hs1/sunday_megathread_whats_everyone_working_on_this/
47,vizex :: a terminal program for the Linux systems where you can visually display disk space and disk space usage and some other details,https://www.reddit.com/r/Python/comments/iw22nu/vizex_a_terminal_program_for_the_linux_systems/
48,How to carbon offset yourself (simulator),https://www.reddit.com/r/Python/comments/iw3sox/how_to_carbon_offset_yourself_simulator/
49,How does Django validate passwords?,https://ranvir.xyz/blog/how-does-django-validate-passwords/
50,How Prevalent is Python in the Embedded Industry?,https://www.reddit.com/r/Python/comments/ivs8be/how_prevalent_is_python_in_the_embedded_industry/
51,Why is there no hardcover book on Python Celery Best Practices?,https://www.reddit.com/r/Python/comments/ivy2qw/why_is_there_no_hardcover_book_on_python_celery/
52,Why Anaconda for python/Spyder?,https://www.reddit.com/r/Python/comments/ivw6ir/why_anaconda_for_pythonspyder/
53,When are you good enough at Python?,https://www.reddit.com/r/Python/comments/ivaujt/when_are_you_good_enough_at_python/
54,Python vs Perl: Which One is A Better Option for You?,https://techbiason.com/python-vs-perl/
55,Anyone else finds it somewhat hilarious that Guido van Rossum's homepage has 80 percent info about his name ONLY.,https://python.org/~guido
56,How do you guys code when you were a beginner?,https://www.reddit.com/r/Python/comments/iv0o87/how_do_you_guys_code_when_you_were_a_beginner/
57,How to find out the greenest day 🌳 of the year for each location,https://blog.gishub.org/earth-engine-tutorial-36-how-to-find-out-the-greenest-day-of-the-year-for-each-location-ckf6zho53000mots1ddktg9ko
58,I published a tutorial where I extract Mel spectrograms from audio data with Python,https://www.reddit.com/r/Python/comments/iulasg/i_published_a_tutorial_where_i_extract_mel/
59,"How to replace loops with combination of lambda function, map, reduce and filter",https://www.reddit.com/r/Python/comments/iusj7e/how_to_replace_loops_with_combination_of_lambda/
60,I made an application that lets you display your Spotify Now Playing anywhere that supports SVG images! Including GitHub Readmes,https://www.reddit.com/r/Python/comments/itwnpp/i_made_an_application_that_lets_you_display_your/
61,How to Test Complex Data in Python,https://miguendes.me/how-to-test-complex-data-in-python-ckf4e1gso006vpos1gh6fhsh4
62,How to use geemap and Earth Engine in Google Colab,https://blog.gishub.org/earth-engine-tutorial-35-how-to-use-geemap-and-earth-engine-in-google-colab-ckf5c403a02xnors1e5ie3i79
63,automation task-runner project - how to automate the boring things when you're automating things,https://www.reddit.com/r/Python/comments/itt4k2/automation_taskrunner_project_how_to_automate_the/
64,[Guidance] What to do with my Python skills to better the world?,https://www.reddit.com/r/Python/comments/itgpaq/guidance_what_to_do_with_my_python_skills_to/
65,"I created an array visualizer using circles, that's how it look when I use Insertion Sort on it.",https://www.reddit.com/r/Python/comments/itbt20/i_created_an_array_visualizer_using_circles_thats/
66,How I Write Meaningful Tests for AWS Lambda Functions,https://towardsdatascience.com/how-i-write-meaningful-tests-for-aws-lambda-functions-f009f0a9c587
67,What in-built python features you have never used?,https://www.reddit.com/r/Python/comments/isjeuf/what_inbuilt_python_features_you_have_never_used/
68,Machine Learning for Finance: This is how you can implement Bayesian Regression using Python,https://laconicml.com/implement-bayesian-regression-python/
69,What's the coolest library you've made yourself?,https://www.reddit.com/r/Python/comments/isksdg/whats_the_coolest_library_youve_made_yourself/
70,"Why You Should Never, Ever print() in a Lambda Function",https://towardsdatascience.com/why-you-should-never-ever-print-in-a-lambda-function-f997d684a705
71,Roll your own static site generator in Python: who has re-invented the wheel and is proud of it?,https://www.reddit.com/r/Python/comments/isl50f/roll_your_own_static_site_generator_in_python_who/
72,"What would be easier to learn for a beginner, Django or flask? Keeping in mind my requirements",https://www.reddit.com/r/Python/comments/isgklg/what_would_be_easier_to_learn_for_a_beginner/
73,How to Collect Data from TikTok with a few Python code lines,https://scrapingant.com/how-to-collect-data-from-tiktok/
74,Python vs Java in 2020 - What is your opinion?,https://www.reddit.com/r/Python/comments/isa3kf/python_vs_java_in_2020_what_is_your_opinion/
75,Sunday megathread: What's everyone working on this week?,https://www.reddit.com/r/Python/comments/irnq16/sunday_megathread_whats_everyone_working_on_this/
76,Is it possible to make PyCharm cloud-based? Like google docs where it saves on all PC's you have and you can open it on any PC and it'll be updated.,https://www.reddit.com/r/Python/comments/ir3zha/is_it_possible_to_make_pycharm_cloudbased_like/
77,How to containerize a Python application,https://www.pybootcamp.com/blog/how-to-containerize-python-application/
78,how do I move on to the next level?,https://www.reddit.com/r/Python/comments/irxp9i/how_do_i_move_on_to_the_next_level/
79,Generators in Python: What are they and their advantages!,https://www.reddit.com/r/Python/comments/iqqs7w/generators_in_python_what_are_they_and_their/
80,How to Build a Python Package,https://edeediong.me/how-to-build-a-python-package
81,How to Publish Your First Python App on Heroku,https://medium.com/@henson.casper/how-to-publish-your-first-python-app-on-heroku-6af91c5bb138
82,A walk-through on how to use conda package manager to set up manimlib (python package for video animations),https://www.reddit.com/r/Python/comments/iqrmjm/a_walkthrough_on_how_to_use_conda_package_manager/
83,What would you like from a model that recommends pc components based on the purchasers usecase?,/r/deeplearning/comments/iqowvk/what_would_you_like_from_a_model_that_recommends/
84,How to Convert a PDF document to Microsoft Word with Python,https://medium.com/@tilalahmad/how-to-convert-pdf-to-word-document-with-python-129fce5a8e62
85,Sync vs. Async Python: What is the Difference?,https://blog.miguelgrinberg.com/post/sync-vs-async-python-what-is-the-difference
